{
  "$schema": "https://json-schema.org/draft/2020-12/schema",
  "$id": "https://purchase-research-agent.local/contracts/collector/v1-29cm/29cm-crawl-item.schema.json",
  "title": "29CM 크롤러 상품 항목 v1-29cm",
  "description": "purchase-research-agent의 Cm29Crawler(app/crawlers/cm29/crawler.py)가 반환하는 상품 dict 1건의 스키마. display-bff-api.29cm.co.kr 내부 JSON API에서 직접 수집하므로 HTML 파싱 없이 구조화된 데이터를 얻는다. 카테고리 크롤링은 현재 미지원 — 키워드 검색(pageType=SRP)만 가능.",
  "type": "object",
  "additionalProperties": false,
  "required": [
    "source_product_id",
    "title",
    "brand",
    "price",
    "price_original",
    "discount_percent",
    "image_url",
    "color",
    "style_code",
    "link",
    "site"
  ],
  "properties": {
    "site": {
      "const": "29cm"
    },
    "source_product_id": {
      "type": "string",
      "minLength": 1,
      "maxLength": 50,
      "description": "29CM itemId(숫자)를 str()로 변환한 값."
    },
    "title": {
      "type": "string",
      "minLength": 1,
      "maxLength": 300,
      "description": "itemInfo.productName"
    },
    "brand": {
      "type": "string",
      "maxLength": 100,
      "description": "itemInfo.brandName. API가 null을 반환하면 빈 문자열로 저장한다."
    },
    "price": {
      "$ref": "#/$defs/priceString",
      "description": "itemInfo.sellPrice → '{n,nnn}원' 형태로 변환."
    },
    "price_original": {
      "$ref": "#/$defs/priceString",
      "description": "itemInfo.originalPrice → '{n,nnn}원' 형태로 변환. originalPrice가 null이면 빈 문자열."
    },
    "discount_percent": {
      "type": ["integer", "null"],
      "minimum": 0,
      "maximum": 100,
      "description": "itemInfo.saleRate를 round()한 정수. saleRate가 null이면 null."
    },
    "image_url": {
      "type": "string",
      "maxLength": 500,
      "description": "itemInfo.thumbnailUrl. null이면 빈 문자열."
    },
    "color": {
      "type": "string",
      "maxLength": 200,
      "description": "attach_details() 시 options[].value에서 추출한 고유 색상 목록 (콤마 구분). 상세 미수집 시 빈 문자열."
    },
    "style_code": {
      "type": "string",
      "maxLength": 0,
      "description": "29CM 목록 API는 style code를 제공하지 않는다 — 항상 빈 문자열."
    },
    "link": {
      "type": "string",
      "minLength": 1,
      "maxLength": 500,
      "pattern": "^https://(www|product)\\.29cm\\.co\\.kr/.*$",
      "description": "itemUrl.webLink. www.29cm.co.kr 또는 product.29cm.co.kr 도메인."
    },
    "rating": {
      "type": ["number", "null"],
      "minimum": 0,
      "maximum": 5,
      "description": "review-api averagePoint (리뷰 API 우선, 없으면 JSON-LD aggregateRating.ratingValue)."
    },
    "review_count": {
      "type": ["integer", "null"],
      "minimum": 0,
      "description": "review-api count (리뷰 API 우선, 없으면 JSON-LD aggregateRating.reviewCount)."
    },
    "images": {
      "type": "array",
      "items": { "type": "string", "maxLength": 500 },
      "description": "JSON-LD image[] — 상세·상세컷 포함 다중 이미지 URL."
    },
    "category": {
      "type": "string",
      "maxLength": 100,
      "description": "JSON-LD Product.category — 최소 카테고리명(예: '플랫')."
    },
    "category_path": {
      "type": "string",
      "maxLength": 200,
      "description": "Breadcrumb에서 조합한 전체 경로 (예: '여성슈즈 > 플랫슈즈 > 플랫')."
    },
    "category_codes": {
      "type": "object",
      "additionalProperties": { "type": "string" },
      "description": "categoryLargeCode / categoryMediumCode / categorySmallCode."
    },
    "in_stock": {
      "type": ["boolean", "null"],
      "description": "JSON-LD offers.availability — InStock 여부."
    },
    "options": {
      "type": "array",
      "items": {
        "type": "object",
        "properties": {
          "name":  { "type": "string" },
          "value": { "type": "string" }
        }
      },
      "description": "스트리밍 데이터에서 파싱한 옵션 목록 (SIZE / COLOR 등, KR·IT 사이즈 포함)."
    },
    "reviews": {
      "type": "array",
      "items": { "$ref": "#/$defs/review" },
      "description": "review-api.29cm.co.kr/api/v4/reviews에서 수집한 리뷰 목록."
    },
    "verification": {
      "$ref": "#/$defs/verification",
      "description": "검색 JSON과 상품 상세 HTML의 Product JSON-LD 대조 결과. app/crawlers/cm29/verification.py가 채운다."
    }
  },
  "$defs": {
    "priceString": {
      "type": "string",
      "pattern": "^$|^[0-9,]+원$",
      "description": "빈 문자열 또는 '89,000원' 형태."
    },
    "review": {
      "type": "object",
      "additionalProperties": false,
      "required": ["review_source_id", "content", "score", "date", "size"],
      "properties": {
        "review_source_id": { "type": "string", "maxLength": 50 },
        "content":          { "type": "string", "maxLength": 500 },
        "score":            { "type": ["number", "null"], "minimum": 0, "maximum": 5 },
        "date":             { "type": "string", "maxLength": 10 },
        "size":             { "type": "string", "maxLength": 200, "description": "optionValue — 타입 태그([SIZE] 등) 제거 후 합친 문자열." },
        "user_size":        { "type": "array", "items": { "type": "string", "maxLength": 20 }, "description": "사용자 신발 사이즈 (예: ['240mm'])." },
        "helpful_count":    { "type": "integer", "minimum": 0 },
        "images":           { "type": "array", "items": { "type": "string", "maxLength": 500 } },
        "partner_comment":  { "type": ["string", "null"], "maxLength": 1000 },
        "size_survey":      { "type": ["string", "null"], "enum": ["작음", "맞음", "큼", null] },
        "is_blind":         { "type": "boolean" }
      }
    },
    "verification": {
      "type": "object",
      "additionalProperties": false,
      "required": [
        "status",
        "compared_fields",
        "differences",
        "json_source_url",
        "html_source_url",
        "verified_at"
      ],
      "properties": {
        "status": {
          "enum": ["PENDING", "MATCHED", "MISMATCH", "MISSING_IN_HTML", "MISSING_IN_JSON", "FAILED"]
        },
        "compared_fields": {
          "type": "array",
          "items": {"type": "string", "maxLength": 100},
          "uniqueItems": true
        },
        "differences": {
          "type": "array",
          "items": {
            "type": "object",
            "additionalProperties": false,
            "required": ["field", "json_value", "html_value"],
            "properties": {
              "field": {"type": "string", "maxLength": 100},
              "json_value": {"type": ["string", "null"], "maxLength": 2000},
              "html_value": {"type": ["string", "null"], "maxLength": 2000}
            }
          }
        },
        "json_source_url": {"type": "string", "format": "uri", "maxLength": 2048},
        "html_source_url": {"type": "string", "format": "uri", "maxLength": 2048},
        "verified_at": {"type": "string", "format": "date-time"}
      }
    }
  }
}
